{
  "schema_version": 1,
  "project": "karachi-heat-map",
  "generated": "2026-09-26",
  "note": "Source of truth for progress. A feature is RESOLVED when passes is true, or when dropped is a non-empty reason approved by Samraj and recorded in DECISIONS.md. Never delete a feature or loosen an acceptance criterion.",
  "features": [
    {
      "id": "P0-01",
      "phase": 0,
      "title": "Machine ready",
      "acceptance": [
        "Tool versions printed for OS, git, Python, Node and free disk space",
        "`gh auth status` shows Samraj is logged in"
      ],
      "depends_on": [],
      "passes": true,
      "blocked_on": null,
      "dropped": null,
      "evidence": "macOS 15.7.3 x86_64; git 2.39.5; Node v24.19.0 + npm 11.17.0; 140 GB free; Python 3.12.14 via `uv python install 3.12`; gh 2.101.0 installed from the official cli/cli release, SHA-256 verified against the published checksums file; `gh auth status` -> logged in as samrajukrani0-tech, scopes gist, read:org, repo, workflow."
    },
    {
      "id": "P0-02",
      "phase": 0,
      "title": "Decisions recorded",
      "acceptance": [
        "D1 to D12 appear in DECISIONS.md",
        "each has a status of approved, provisional or deferred",
        "each records Samraj's decision in his own words"
      ],
      "depends_on": [],
      "passes": true,
      "blocked_on": null,
      "dropped": null,
      "evidence": "DECISIONS.md holds D1-D12, each with the question, options, recommendation and reasons, Samraj's decision in his words, a status and the date; `grep -c '^## D' DECISIONS.md` -> 12."
    },
    {
      "id": "P0-03",
      "phase": 0,
      "title": "Scaffold",
      "acceptance": [
        "the PROMPT.md section 4 layout exists (adapted: DESIGN.md is created in P3-01)",
        "CLAUDE.md is at most 150 lines",
        "features.json validates against the schema test",
        "`uv run python scripts/features.py` prints per-phase counts"
      ],
      "depends_on": [
        "P0-02"
      ],
      "passes": true,
      "blocked_on": null,
      "dropped": null,
      "evidence": "PROMPT.md section 4 layout present (DESIGN.md deferred to P3-01 by design); `wc -l CLAUDE.md` -> 135 (limit 150); features.json holds 42 features and validates against tests/features.schema.json; `uv run python scripts/features.py` prints per-phase counts plus an overall line."
    },
    {
      "id": "P0-04",
      "phase": 0,
      "title": "Checks and CI",
      "acceptance": [
        "`uv run python scripts/check.py --quick` prints CHECK: PASS on the scaffold",
        "the first GitHub Actions run is green, with its status printed via gh"
      ],
      "depends_on": [
        "P0-03"
      ],
      "passes": true,
      "blocked_on": null,
      "dropped": null,
      "evidence": "`uv run python scripts/check.py --quick` -> 'CHECK: PASS (3 checks)'; `uv run pytest` -> 22 passed; GitHub Actions run 36238295986 completed success with jobs check: success and deploy: success."
    },
    {
      "id": "P0-05",
      "phase": 0,
      "title": "Live placeholder",
      "acceptance": [
        "the public repo is pushed",
        "Pages deploys from GitHub Actions",
        "the placeholder URL returns HTTP 200, printed"
      ],
      "depends_on": [
        "P0-04"
      ],
      "passes": true,
      "blocked_on": null,
      "dropped": null,
      "evidence": "Public repo pushed to github.com/samrajukrani0-tech/karachi-heat-map; Pages configured with build_type=workflow; `curl -o /dev/null -w '%{http_code}' -L https://samrajukrani0-tech.github.io/karachi-heat-map/` -> 200, serving the placeholder page."
    },
    {
      "id": "P1-01",
      "phase": 1,
      "title": "Pilot boundary",
      "acceptance": [
        "data/processed/pilot_area.geojson exists in EPSG:4326 with provenance",
        "area in km2 printed and within config/area.yaml tolerance of 25.37",
        "preview PNG written to artifacts/"
      ],
      "depends_on": [
        "P0-05"
      ],
      "passes": true,
      "blocked_on": null,
      "dropped": null,
      "evidence": "uv run python -m pipeline.boundary -> 'Area: 25.370 km2 (config expects 25.37 +/- 0.75)', 1 ring, 0 interior holes; wrote data/processed/pilot_area.geojson (4.4 kB, EPSG:4326) and artifacts/pilot_area_preview.png (56 kB), which was viewed and shows a single closed polygon, centroid 24.84449, 67.18136. Provenance in the file: OSM relation 16350631, admin_level 7, ODbL 1.0, accessed 2026-09-26, raw response sha256 0a9b249905a9e5ff039f4239e548b90ac247bf9e9d749cad4697ff8af96181e8 (fingerprints the download, not the geometry: Overpass embeds a timestamp). uv run pytest -> 39 passed in 0.76s; uv run python scripts/check.py --quick -> 'CHECK: PASS (3 checks)'."
    },
    {
      "id": "P1-02",
      "phase": 1,
      "title": "Grid",
      "acceptance": [
        "H3 resolution 9 cells cover the boundary",
        "the inclusion rule from config/area.yaml is implemented and documented",
        "cell count printed",
        "tests: IDs valid, no duplicates, cells cover at least 99% of the boundary"
      ],
      "depends_on": [
        "P1-01"
      ],
      "passes": true,
      "blocked_on": null,
      "dropped": null,
      "evidence": "uv run python -m pipeline.grid -> 265 cells at H3 resolution 9 (248 by centre, 17 by the >=25% area rule); 'Coverage of the boundary: 99.115% (minimum 99%)'; hexagon area 27.080 km2, clipped 25.145 km2 against a boundary of 25.370 km2, overhang 1.935 km2 excluded from every indicator by clipping. Wrote data/processed/grid.geojson (130 kB) and artifacts/grid_preview.png, which was viewed and shows a gapless tiling with edge cells exactly where the boundary bulges past a cell centre. tests/test_grid.py adds 12 tests that recompute coverage, the inclusion rule, clipped areas and contiguity from the stored geometry rather than trusting the file's metadata. uv run pytest -> 51 passed in 1.03s; uv run python scripts/check.py --quick -> 'CHECK: PASS (3 checks)'. Inclusion rule revised under D15 (provisional, QUESTIONS.md Q5)."
    },
    {
      "id": "P1-03",
      "phase": 1,
      "title": "Download cache",
      "acceptance": [
        "pipeline/fetch.py handles retries, backoff, checksums and manifest.json",
        "a second run uses the cache and downloads nothing",
        "tests use mocked responses"
      ],
      "depends_on": [
        "P0-03"
      ],
      "passes": true,
      "blocked_on": null,
      "dropped": null,
      "evidence": "pipeline/fetch.py streams to a .part file while hashing, renames atomically, retries only the transient statuses {408,425,429,500,502,503,504} with exponential backoff capped at 120 s and honours Retry-After, and records url, sha256, bytes, date and licence in data/raw/manifest.json. Cache reuse verified live: a second 'uv run python -m pipeline.boundary' printed the same 'Area: 25.370 km2' with no download line; 'uv run python -m pipeline.fetch --verify' -> 'Verified 1 cached file(s): all match the manifest'. tests/test_fetch.py adds 17 tests on a mocked transport with SYNTHETIC payloads, covering: manifest contents, zero network calls on the second run, refresh, tampered cache re-downloaded, an unmanifested file not trusted, checksum mismatch raising IntegrityError and removing the file, retry-then-succeed with growing backoff, Retry-After honoured, backoff capped, 404 never retried, give-up after the try limit, and .part cleanup. uv run pytest -> 68 passed in 1.49s; check.py --quick -> 'CHECK: PASS (3 checks)'."
    },
    {
      "id": "P1-04a",
      "phase": 1,
      "title": "Hot-season LST composite",
      "acceptance": [
        "Landsat 8/9 C2 L2 April-June scenes found via STAC and read as windows, not whole scenes",
        "cloud, shadow, cirrus, dilated cloud and fill masked with qa_pixel",
        "USGS scaling applied: kelvin = 0.00341802 * DN + 149.0, then to degrees Celsius",
        "per-pixel median composite, with a documented minimum number of clear looks",
        "scene list and per-scene cloud statistics recorded in data/processed/lst_scenes.csv",
        "composite values inside the documented plausible range in config/heat.yaml"
      ],
      "depends_on": [
        "P1-02",
        "P1-03"
      ],
      "passes": true,
      "blocked_on": null,
      "dropped": null,
      "evidence": "uv run python -m pipeline.lst -> 48 Landsat 8/9 C2 L2 scenes, April-June 2022-2026, scene cloud cover <= 50%, all WRS path 152 row 043. Each scene read as a window over Landhi only, never the whole scene. Composite 278 x 244 px at 30 m; clear looks per pixel min 33, median 42, max 47; 0 of 67832 pixels dropped for fewer than 5 clear looks. 'LST degC: min 31.25, median 43.16, max 48.11' -- inside the documented plausible range 20-65 in config/heat.yaml. Wrote data/raw/derived/lst_hot_season.tif (195 kB, 2 bands: median LST and clear-look count) and data/processed/lst_scenes.csv (48 rows with per-scene cloud cover and usable-pixel fraction over Landhi). tests/test_lst.py adds 20 tests: each QA bit verified against Landsat's documented bit order, unlisted confidence bits proven not to mask, the USGS scaling checked against a hand-computed DN, and every recorded scene checked for season, year, platform and cloud limit. 4 tests that open the gitignored raster are marked raw. uv run pytest -> 88 passed; CI=true pytest -m 'not raw' -> 84 passed, 4 deselected; check.py --quick -> 'CHECK: PASS (3 checks)'."
    },
    {
      "id": "P1-04b",
      "phase": 1,
      "title": "Daytime heat per cell",
      "acceptance": [
        "per-cell mean and 90th-percentile hot-season LST in degC",
        "statistics computed over the CLIPPED cell geometry (D15), never the whole hexagon",
        "cells with too little clear coverage are flagged, not silently averaged",
        "values inside the documented plausible range",
        "map PNG in artifacts/"
      ],
      "depends_on": [
        "P1-04a"
      ],